Key,lang-en.json,lang-ht.json,lang-ru.json,lang-zh-hans.json,lang-ko.json,lang-vi.json,lang-es.json,lang-zh-hant.json
children.p.introOneQCBold,"Based on your previous responses, you may have 1 qualifying child with a valid Social Security number.","Konsideran repons anvan ou yo, ou ka gen 1 timoun ki elijib ak yon nimewo sekirite sosyal valab.","Исходя из ваших предыдущих ответов, у вас может быть 1 отвечающий требованиям ребенок с действительным номером социального обеспечения.",根据您之前的回复，您可能有 1 名符合条件的子女，并且其有有效的社会安全号码。,"귀하의 이전 답에 따르면, 귀하는 유효한 사회보장 번호를 가진 1명의 적격 자녀가 있습니다.","Dựa trên những câu trả lời trước đây của quý vị, quý vị có thể có 1 trẻ đủ điều kiện có số An Sinh Xã Hội hợp lệ.","Según sus respuestas anteriores, es posible que tenga un hijo que cumpla con los requisitos de un número de seguro social válido.",根據您之前填入的資料，您可能有 1 名具有有效社會安全號碼的合格子女。
children.p.introPlus,"In this step, we'll see how many of your children or other relatives are your qualifying children for the purposes of claiming and calculating the EITC. You can claim up to three qualifying children for the EITC.","Nan etap sa a, n ap wè konbyen nan pitit ou yo oswa lòt fanmi ou yo ki se pitit ou ki kalifye pou fè reklamasyon ak kalkile EITC a. Ou ka reklame jiska twa timoun ki kalifye pou EITC.","На данном этапе мы выясним, сколько ваших детей или других родственников могут быть квалифицированы как дети, отвечающие требованиям для подачи заявления и расчета EITC. Вы можете заявить до трех детей, соответствующих установленным требованиям, на получение EITC. ",在这一步中，我们将了解有多少子女或其他亲属是您符合申请和计算 EITC 条件的子女。您最多可以为三个符合条件的子女申请 EITC。,이 단계에서는 EITC 청구 및 계산을 위해 귀하의 자녀 또는 기타 친척 중 적격 자녀가 몇 명인지 확인합니다. 최대 3명의 적격 자녀까지 EITC를 청구할 수 있습니다.,"Trong bước này, chúng tôi sẽ xem có bao nhiêu người con hoặc người thân khác của quý vị là trẻ đủ điều kiện để yêu cầu và tính toán EITC. Quý vị có thể khai tối đa ba trẻ đủ điều kiện để nhận EITC.","En este paso, veremos cuántos de sus hijos u otros familiares son sus hijos calificados a efectos de solicitar y calcular el EITC. Puede solicitar el EITC para un máximo de tres hijos calificados.",在此步驟中，我們將了解您的子女或其他親屬中有多少人符合申請和計算 EITC 的資格。您最多可以為三位符合資格的子女申請 EITC。
children.p.live51PctTT1,"A qualifying child must have the same main home as you for more than half of :year and that home must have been in the United States. The United States includes the 50 states and the District of Columbia. It does not include Puerto Rico or United States territories such as Guam. For the EITC, the IRS considers U.S. military personnel stationed outside the United States on extended active duty to have a main home in the United States during that period of duty.","Yon timoun ki kalifye dwe gen menm kay prensipal ak ou pou plis pase mwatye ane :year a e kay sa a te dwe sitiye Etazini. Etazini gen ladan 50 eta yo ak Distri Columbia. Li pa enkli Pòtoriko oswa teritwa Etazini yo tankou Guam. Pou EITC a, IRS la konsidere pèsonèl militè Ameriken ki estasyone andeyò Etazini nan sèvis aktif pwolonje tankou yo gen yon kay prensipal Etazini pandan peryòd sèvis sa a.","Ребенок, соответствующий требованиям, должен проживать в одном с вами основном доме в течение более половины :year года, и этот дом должен находиться в США. Соединенные Штаты Америки включают в себя 50 штатов и округ Колумбия. В это число не входят Пуэрто-Рико и территории США, такие как Гуам. Для получения Налогового зачета за заработанный доход (EITC) Налоговое управление США рассматривает американских военнослужащих, находящихся за пределами США на длительной действительной службе, как имеющих основной дом в США в течение этого периода службы.",符合条件的子女必须在 :year 年有一半以上的时间内在同一主要住所与您同住，且该住所必须位于美国境内。美国包括 50 个州和哥伦比亚特区。美国不包括波多黎各或关岛等美国领地。就 EITC 而言，国税局认为在美国境外驻扎超期服役的美国军人服役期间在美国境内有一处主要住所。,"자격을 갖춘 자녀는 :year년 중 절반 이상을 귀하와 동일한 주 거주지에 거주해야 하며, 해당 거주지가 미국에 있어야 합니다. 미국에는 50개 주와 컬럼비아 특별구가 포함됩니다. 푸에르토리코 또는 괌과 같은 미국령은 포함되지 않습니다. EITC의 경우, IRS는 연장된 현역 복무로 미국 외 지역에 주둔하는 미국 군인을 해당 복무 기간 동안 미국에 주 거주지가 있는 것으로 간주합니다.","“Trẻ đủ điều kiện phải sống cùng nhà chính với quý vị trong hơn nửa năm :year và nhà đó phải ở Hoa Kỳ. Hoa Kỳ bao gồm 50 tiểu bang và Quận Columbia. Nó không bao gồm Puerto Rico hoặc các lãnh thổ của Hoa Kỳ như Guam. Đối với Tín Thuế Thu Nhập Kiếm Được (Earned Income Tax Credit (EITC), Sở Thuế Vụ (Internal Revenue Service (IRS) coi các quân nhân Hoa Kỳ đóng quân bên ngoài Hoa Kỳ trong thời gian làm nhiệm vụ kéo dài có nhà chính ở Hoa Kỳ trong thời gian làm nhiệm vụ đó.","Un hijo calificado debe tener el mismo hogar principal que usted durante más de la mitad de :year y ese hogar debe ser en los Estados Unidos. Estados Unidos incluye los 50 estados y el Distrito de Columbia. No incluye Puerto Rico ni territorios de Estados Unidos como Guam. En cuanto al crédito tributario por ingreso del trabajo (EITC, por sus siglas en inglés), el IRS considera que el personal militar estadounidense destinado fuera de los Estados Unidos en servicio activo prolongado tiene un hogar principal en los Estados Unidos durante ese período de servicio.",符合資格的子女必須在 :year 年一半以上的時間內與您擁有相同的主要住所，並且該住宅必須位於美國。美國包括 50 個州和哥倫比亞特區。它不包括波多黎各或關島等美國屬地。對於 EITC，IRS 認為駐紮在美國境外長期服役的美國軍事人員在服役期間在美國擁有主要住所。
children.p.live51PctTT2,"If the child was born or died in :year, the child must have lived with you for more than half the part of the year he or she was alive."," Si timoun nan te fèt oubyen te mouri nan :year, timoun nan dwe viv avèk ou pou plis pase mwatye ane li te vivan an.","Если ребенок родился или умер в :year, ребенок должен прожить с вами более половины части года, в течение которого он был жив.",如果这名子女于 :year 出生或去世，则这名子女在世的这一年中必须有超过一半的时间与您共同生活。,":year년에 출생하거나 죽은 자녀가 있다면, 자녀는 반드시 살아 있던 그 해의 기간의 반 이상 동거해야 합니다.","Nếu đứa trẻ được sinh ra hoặc qua đời vào :year, đứa trẻ đó bắt buộc phải sống với quý vị hơn một nửa thời gian của năm đó khi mà trẻ còn sống.","Si el hijo nació o falleció en el año :year, debe haber vivido con usted por más de la mitad del año en que estuvo vivo.",如果子女在 :year 年出生或死亡，則子女在該年中活著的時間必須有超過一半的時間是與您一起生活。
children.p.live51PctTT3,"For the EITC, a temporary absence counts as time lived with you. Examples include:","Pou EITC a, yon absans tanporè konte kòm tan pase avèk ou. Egzanp yo enkli:","Для получения EITC временное отсутствие засчитывается как время, прожитое с вами. Примеры включают:",就 EITC 而言，临时缺席视为与您共同生活。例子包括：,EITC의 경우 임시 부재는 귀하와 동거한 시간으로 간주합니다. 예는 다음과 같습니다.,"Đối với EITC, thời gian vắng mặt tạm thời được tính là thời gian sống cùng quý vị. Các ví dụ bao gồm:","Para el Crédito tributario por ingreso del trabajo, una ausencia temporal cuenta como tiempo vivido con usted. Algunos ejemplos son:",就 EITC 而言，暫時缺席算作與您一起生活的時間。範例包括：
children.p.live51PctTT4,"For more information, see :irsPub519, Earned Income Credit, residency test.","Pou plis enfòmasyon, gade :irsPub519.",Более подробную информацию смотрите :irsPub519.,欲了解更多信息，请参阅 :irsPub519。,자세한 정보는  :irsPub519를 확인하세요.,"Để biết thêm thông tin, xem :irsPub519.","Para obtener más información, visite la :irsPub519.",如需瞭解更多資訊，請參閱 :irsPub519。
children.p.live51PctTT5,"If you adopted the child in :year1, the child was lawfully placed with you for legal adoption by you in :year2, or the child was an eligible foster child placed with you during :year3, your main home must have been this child’s main home for more than half the time since he or she was adopted or placed with you in :year4.","Si ou te adopte yon timoun an :year1, ou te swiv pwosedi legal yo pou adopsyon legal timoun nan nan :year2 a, oswa timoun nan te yon timoun kalifye ki te plase lakay ou nan :year3 a, rezidans prensipal ou te dwe rezidans timoun sa a pandan plis pase mwatye tan depi lè ou te adopte li oswa depi lè li te plase lakay ou nan :year4 a","Если вы усыновили ребенка в :year1 году, либо ребенок был законно переселён к вам для законного усыновления в :year2 году, или же ребенок является приемным, он соответствует требованиям и был переселён к вам в :year3 году, то ваше основное место жительства должно быть основным местом жительства этого ребенка более половины времени с момента его усыновления или переселения к вам в :year4 году. ",如果您在 :year1 年收养了该子女，该子女在 :year2 年被合法安置在您身边供您合法收养，或者该子女是在 :year3 年与您同住的合格寄养儿童，则自 :year4 年该子女被收养或安置在您身边以来，您的主要住所必须有一半以上的时间是该子女的主要住所。,"귀하가 :year1년에 자녀를 입양한 경우, 해당 아동이 :year2년에 합법적으로 입양될 수 있도록 귀하와 합법적으로 함께 있었거나. 또는 해당 아동이 :year3년에 귀하에게 입양된 적격 위탁 아동인 경우, 귀하의 주 거주지는 :year4년에 귀하에게 입양되거나 배정된 이후 절반 이상 동안 이 자녀의 주 거주지여야 합니다. ","Nếu quý vị nhận nuôi trẻ vào năm :year1, trẻ được giao cho quý vị làm con nuôi hợp pháp vào năm :year2, hoặc trẻ đó là con nuôi tạm đủ điều kiện được giao cho quý vị trong năm :year3, thì nhà chính của quý vị phải là nhà chính của trẻ này hơn một nửa thời gian kể từ khi trẻ được nhận làm con nuôi hoặc được giao cho quý vị vào năm :year4. ","Si usted adoptó a un hijo en el :year1, el hijo fue puesto bajo su custodia legalmente para que usted luego lo adoptara en el :year1, o si el hijo fue hijo de crianza elegible puesto bajo su custodia durante el :year1, su vivienda principal tiene que haber sido la vivienda principal del hijo durante más de la mitad del tiempo a partir del momento en que fue adoptado o puesto bajo su custodia en el :year1.",如果您在 :year1 年收養了該名子女、該名子女在 :year2 年被合法安置在您身邊供您合法收養，或者該名子女是在 :year3 年期間安置給您的合資格寄養子女，自從他或她在 :year4 年被收養或安置在您身邊以來，必須有超過一半的時間您的主要住所是該名子女的主要住所。 
children.p.noQCAlert,"The child must have the same main home as you in the United States for more than half the year. See :link, Earned Income Credit, for the residency test.","Timoun nan dwe gen menm rezidans prensipal ak ou Ozetazini pou plis pase mwatye nan ane a. Gade :link, Kredi Sou Revni Ou Fè, pou tès rezidans lan.","Ребенок должен проживать в одном основном доме с вами в Соединенных Штатах более половины года. Проверка места жительства налогоплательщика см. :ссылка, Зачет за заработанный доход.",这名子女在这一年中必须有超过一半的时间与您共同生活于同一所位于美国的主要居所。对于居所测试，请参阅 :link，劳动所得抵免。,자녀는 반드시 미국에서 귀하와 해당 연도에 반년 이상 같은 주거지에 있어야 합니다. 영주권 테스트를 위한 근로 소득 세액공제는 :link를 확인하세요.,"Đứa trẻ phải sống trong ngôi nhà chính với quý vị ở Hoa Kỳ trong hơn nửa năm đó. Để biết thêm về tiêu chuẩn cứu xét về tình trạng cư trú, xem :link, Tín Thuế Thu Nhập Kiếm Được."," El hijo debe tener el mismo domicilio principal que usted en los Estados Undos durante más de la mitad del año. Vea :link, crédito por ingreso del trabajo, para comprobar el requisito de residencia.",該名子女在美國的主要住所必須與您的相同超過半年的時間。有關居住測試，請參閱 :link 的勞動所得稅務優惠。
children.p.noQcButCreditMessage,"If you have other children or relatives you believe may qualify, please add them on this page. You can claim up to three qualifying children for the EITC.","Si w gen lòt timoun oswa fanmi w kwè ki ka kalifye, tanpri ajoute yo sou paj sa a. Ou ka reklame jiska twa timoun ki kalifye pou EITC.","Если у вас есть другие дети или родственники, которые, по вашему мнению, соответствуют установленным требованиям, пожалуйста, добавьте их на эту страницу. Вы можете заявить до трех детей, соответствующих установленным требованиям, на получение EITC.",如果您认为还有其他子女或亲属符合条件，请将他们添加到本页。您最多可以为三个符合条件的子女申请 EITC。,자격이 있다고 생각되는 다른 자녀나 친척이 있다면 이 페이지에 추가해 주세요. 최대 3명의 적격 자녀까지 EITC를 청구할 수 있습니다.,"Nếu quý vị có con cái hoặc người thân khác mà quý vị tin rằng có thể đủ điều kiện, vui lòng thêm họ vào trang này. Quý vị có thể khai tối đa ba trẻ đủ điều kiện để nhận EITC.","Si tiene otros hijos o familiares que cree que pueden calificar, añádalos en esta página. Puede solicitar el EITC para un máximo de tres hijos calificados.",如果您認為您還有其他子女或親戚可能符合資格，請將他們添加到此頁面上。您最多可以為三位符合資格的子女申請 EITC。
children.p.notQualifies,:child does not qualify.,:child does not qualify.,:child не соответствует требованиям.,:child 不符合条件。,:child는 적격이 아닙니다.,:child không đủ điều kiện.,El :child no reúne los requisitos.,:child 不符合資格。
children.p.permanentlyDisabledTT1,"For the EITC, we consider a child permanently and totally disabled if both of the following are true:","Pou EITC a, nou konsidere yon timoun andikape nèt ak totalman si de kondisyon sa yo ranpli:","Для EITC мы считаем ребенка постоянно и полностью нетрудоспособным, если верны оба следующих условия:",就 EITC 而言，如果以下两项条件均满足，则我们将一名子女视为永久、完全残障：,EITC의 경우 다음의 두경우가 모두 참이면 영구적이고 완전한 장애로 여깁니다.,"Đối với EITC, chúng tôi coi trẻ bị tàn tật toàn phần và vĩnh viễn nếu cả hai điều sau đều đúng:","Para el Crédito tributario por ingreso del trabajo, se considera que un hijo tiene una incapacidad permanente y total si las siguientes dos condiciones son verdaderas:",就 EITC 而言，如果滿足以下兩項聲明，我們將認為子女永久完全殘疾：
children.p.permanentlyDisabledTT2,"For more information see :irsPub519, Earned Income Credit, Permanently and Totally Disabled.",Pou plis enfòmasyon gade :irsPub519.,Более подробную информацию смотрите в :irsPub519.,欲了解更多信息，请参阅 :irsPub519。,자세한 정보는  :irsPub519를 확인하세요.,"Để biết thêm thông tin, xem :irsPub519.","Para obtener más información, visite :irsPub519.",如需瞭解更多資訊，請參閱 :irsPub519。
children.p.previous,On this step you will determine which of your children or other relatives are qualifying children for the purposes of claiming and calculating the Earned Income Tax Credit. You must answer these questions in order.,"Nan etap sa a, w ap detèmine kilès nan timoun ou yo oswa lòt fanmi ou yo ki se timoun kalifye nan objektif pou reklame ak kalkile Kredi Enpo sou Revni ou Antre a. Ou dwe reponn kesyon sa yo nan lòd.","На этом шаге вы определите, кто из ваших детей или других родственников является отвечающими требованиям детьми для целей подачи заявления и расчета налогового зачета за заработанный доход. Вы должны ответить на эти вопросы по порядку.",在这一步中，您需要确认您的哪名孩子或其他亲属可作为符合条件的孩子进行劳动所得税抵免申请和计算。您必须按顺序回答这些问题。,이 단계에서 귀하의 자녀 혹은 기타 친척 중 누가 근로 소득 세액공제를 신청하고 계산하기 위해 적격 자녀인지 결정할 것입니다. 귀하는 반드시 순서대로 답을 해야 합니다.,"Trong bước này, quý vị sẽ xác định trẻ nào hoặc thân nhân khác nào của mình là trẻ đủ điều kiện cho mục đích yêu cầu và tính toán Tín Thuế Thu Nhập Kiếm Được. Quý vị phải trả lời những câu hỏi này theo thứ tự.",En este paso determinará cuáles de sus hijos u otros familiares son hijos que reúnen con los requisitos para solicitar y calcular el crédito tributario por ingreso del trabajo. Debe responder estas preguntas en orden.,在此步驟中，您將判斷您的哪些子女或其他親屬符合申領和計算勞動所得稅務優惠的資格。您必須按順序回答這些問題。
children.p.qualifies,:child qualifies.,:child elijib.,:child отвечает критериям.,:child 符合条件。,:child 는 적격입니다.,:child đủ điều kiện.,:child reúne los requisitos.,:child 符合資格。
children.p.relationshipTT1,"A step relationship is one formed by a marriage. For the EITC, a relationship formed by a marriage, such as a stepdaughter, stepson, stepbrother, or stepsister, doesn't end if the marriage ends.","Yon relasyon etap se yon relasyon ki fòme pa maryaj. Pou EITC a, yon relasyon ki fòme pa maryaj, tankou bèlfi, bofis, demi frè oubyen demi sè, pa fini si maryaj la fini.","Сводные отношения - это отношения, возникшие в результате брака. Для EITC отношения, возникшие в браке, такие как падчерица, пасынок, сводный брат или сводная сестра, не прекращаются, если брак заканчивается.",继亲关系是由婚姻形成的关系。就 EITC 而言，即使婚姻终止，但是婚姻形成的关系，例如继女、继子、继兄弟或继姊妹关系，不会终止。,"의붓 관계는 결혼에 의해 형성된 관계입니다. EITC의 경우, 결혼에 의해 형성된 관계 예를 들어 의붓딸, 의붓아들, 의붓형제 혹은 자매의 관계는 결혼의 지속과 관계없이 계속됩니다.","Mối quan hệ giữa cha dượng/mẹ kế và con riêng của vợ/chồng là mối quan hệ được hình thành bởi một cuộc hôn nhân. Đối với EITC, một mối quan hệ được hình thành bởi một cuộc hôn nhân, chẳng hạn như con gái riêng của vợ/chồng, con trai riêng của vợ/chồng, anh/chị/em kế, sẽ không kết thúc nếu cuộc hôn nhân kết thúc.","El parentesco de familias ensambladas se forma producto de un matrimonio. Para el Crédito tributario por ingreso del trabajo, un parentesco producto",繼親關係是由婚姻形成的關係。就 EITC 而言，由婚姻形成的關係，例如繼女、繼子、繼兄弟或繼姐妹，不會在婚姻結束時結束。
children.p.relationshipTT2,An adopted child is always treated as your own child. This term includes a child who was lawfully placed with you for legal adoption.,Yon timoun adopte toujou trete kòm pwòp pitit ou. Tèm sa a gen ladann yon timoun ki te mete avè w legalman pou adopsyon legal.,"К усыновленному ребенку всегда относятся как к родному. Это понятие включает ребенка, который был передан вам на законных основаниях на усыновление.",领养子女始终视为您本人的子女。领养子女包括合法收养的子女。,입양 자녀는 항상 귀하 자신의 자녀로 여깁니다. 이 조건에는 귀하가 법적으로 법적 입양을 위해 귀하와 함께 하도록 위탁된 아이를 포함합니다.,Con nuôi chính thức luôn được coi như con ruột của quý vị. Thuật ngữ này bao gồm một đứa trẻ được cho làm con nuôi hợp pháp của quý vị., Un hijo adoptado siempre es considerado como hijo propio. Este término incluye a un hijo que ha sido colocado legalmente con usted para su adopción legal.,領養的子女總是被視為您自己的子女。該子女包括合法安置在您身邊以供合法領養的子女。
children.p.relationshipTT3,You can claim a foster child only if the child is placed with you by an authorized placement agency or by court order.,Yon timoun adopte toujou trete kòm pwòp pitit ou. Tèm sa a gen ladann yon timoun ki te mete avè w legalman pou adopsyon legal.,"Вы можете претендовать на приемного ребенка только в том случае, если он был передан вам уполномоченным агентством по устройству детей на воспитание или по решению суда.",只有经授权的安置机构或法院命令将子女安置于您处，您才可将其申请为寄养子女。,해당 자녀가 승인된 위탁 기관 혹은 법원 명령에 의해 귀하에게 위탁되었다면 귀하는 위탁 자녀로 신청할 수 있습니다.,Quý vị chỉ có thể kê khai con nuôi tạm nếu đứa trẻ đó được bố trí ở với quý vị bởi một cơ quan sắp xếp được ủy quyền hoặc theo án lệnh.,Puede reclamar a un hijo de crianza solo si el niño fue colocado con usted por una agencia de colocación autorizada o por orden judicial.,只有當子女被授權的安置機構或法院命令安置在您身邊時，您才能申領寄養子女。
