Key,lang-en.json,lang-ht.json,lang-ru.json,lang-zh-hans.json,lang-ko.json,lang-vi.json,lang-es.json,lang-zh-hant.json
agi.p.educatorTT1,"If you're a teacher, enter up to $300 ($600 if married filing jointly and both you and your spouse are teachers) of unreimbursed expenses such as:","
Si ou se yon pwofesè, antre jiska $250 ($500 si konjwen ap deklare ansanm epi toulède ou menm ak madanm ou se pwofesè) nan depans ki pa ranbouse tankou:","Если вы учитель, укажите сумму до $250 ($500, если вы состоите в браке и оба супруга являются учителями) на невозмещенные расходы, такие как:",如果您是一名教师，请输入最高 250 美元（如果是已婚夫妇联合申报，且您和您的配偶均为教师，则为 500 美元）的未补偿费用，例如：,"귀하가 교사라면, 최대 $250 (부부 공동 신고이며 귀하와 귀하의 배우자 모두 교사이면 $500)의 보상 금액을 입력합니다. 예를 들어:","Nếu quý vị là giáo viên, hãy nhập tối đa $250 ($500 nếu vợ chồng quý vị khai chung hồ sơ thuế và cả quý vị và người phối ngẫu của quý vị đều là giáo viên) cho những chi phí chưa được hoàn lại như:","Si trabaja es un/a maestro/a, ingrese hasta $250 ($500 si está casado/a y presenta una declaración conjunta y si usted y su cónyuge son maestros) de los gastos no reembolsados tales como:",如果您是教師，請填入最多 250 美元（如果已婚共同申報且您和您的配偶都是教師，則為 500 美元）的未核銷費用，例如：
agi.p.educatorTT2,"For more information, see :taxTopic458.",Pou plis enfòmasyon gade :taxTopic458,Более подробную информацию можно найти на сайте :taxTopic458,欲了解更多信息，请参阅 :taxTopic458,자세한 정보는 :taxTopic458를 방문하세요.,"Để biết thêm thông tin, xem :taxTopic458","Para obtener más información, visite :taxTopic458",如需瞭解更多資訊，請參閱 :taxTopic458
agi.p.educatorTT3,"If you're a teacher, enter up to $300 ($600 if married filing jointly and both you and your spouse are teachers) of unreimbursed expenses such as:","
Si ou se yon pwofesè, antre jiska $300 ($600 si konjwen ap deklare ansanm epi toulède ou menm ak madanm ou se pwofesè) nan depans ki pa ranbouse tankou:","Если вы учитель, укажите сумму до $300 ($600, если вы состоите в браке и оба супруга являются учителями) на невозмещенные расходы, такие как:",如果您是一名教师，请输入最高 300 美元（如果是已婚夫妇联合申报，且您和您的配偶均为教师，则为 600 美元）的未补偿费用，例如：,"귀하가 교사라면, 최대 $300 (부부 공동 신고이며 귀하와 귀하의 배우자 모두 교사이면 $600)의 보상 금액을 입력합니다. 예를 들어:","Nếu quý vị là giáo viên, hãy nhập tối đa $300 ($600 nếu vợ chồng quý vị khai chung hồ sơ thuế và cả quý vị và người phối ngẫu của quý vị đều là giáo viên) cho những chi phí chưa được hoàn lại như:","Si trabaja es un/a maestro/a, ingrese hasta $300 ($600 si está casado/a y presenta una declaración conjunta y si usted y su cónyuge son maestros) de los gastos no reembolsados tales como:",如果您是教師，請填入最多 300 美元（如果已婚共同申報且您和您的配偶都是教師，則為 600 美元）的未核銷費用，例如：
agi.p.federalIncomeNotWithheldNote,Your self employment tax is being correctly calculated and applied to your Adjusted Gross Income (AGI).,,,,,,,
agi.p.federalIncomeNotWithheldSubheading,Select Adjustments to Income:,Select Adjustments to Income:,Выберите корректировки к доходу:,选择收入调整：,소득에 조정액을 선택하세요.,Chọn Các Mục Điều Chỉnh đối với Thu Nhập:,Selecciones los ajustes a los ingresos:,選擇收入調整：
agi.p.federalIncomeNotWithheldTT1,"Report income earned from gig work, even if it's a side job, part time or temporary.","Rapòte revni touche nan travay gig, menm si se yon travay sou kote, tan pasyèl, oswa tanporè.","Сообщите о доходах, полученных от экономики свободного заработка, даже если это дополнительная работа, работа на неполный рабочий день или временная работа.",报告零工收入，即使是副业、兼职或临时工作。,"부업, 파트타임 또는 임시직이더라도 긱 작업에서 얻은 소득을 보고하십시오.","Báo cáo thu nhập kiếm được từ công việc tự do, ngay cả khi đó là công việc phụ, bán thời gian hoặc tạm thời.","Informe sus ingresos del trabajo en la economía compartida, incluso si es un trabajo secundario, a tiempo parcial o temporal.",報告零工收入，即使是副業、兼職或臨時工作。
agi.p.federalIncomeNotWithheldTT2,Enter income here if you earn money from a job even if income taxes were not withheld. You may or may not have received a Form 1099 for all income.,Mete revni isit la si ou touche lajan nan yon travay menm si yo pa t kenbe taks sou revni. Ou ka oswa ka pa te resevwa yon Fòm 1099 pou tout revni. ,"Укажите здесь доход, если вы получаете деньги от работы, даже если подоходный налог не удерживался. Возможно, вы получили или не получили Форму 1099 для всех доходов.",如果您从工作中赚到钱，即使没有预扣所得税，也可以在此处输入收入。您可能已经或可能没有收到适用于所有收入的《表格 1099》。,소득세가 원천징수되지 않았더라도 근로를 통해 소득을 얻은 경우 여기에 입력하십시오. 모든 소득에 대해 양식 1099를 받았을 수도 있고 받지 못했을 수도 있습니다.,Nhập thu nhập ở đây nếu quý vị kiếm được tiền từ một công việc ngay cả khi thuế thu nhập không được khấu trừ. Quý vị có thể đã nhận được hoặc không nhận được Mẫu 1099 cho tất cả các khoản thu nhập. ,"Ingrese aquí los ingresos si gana dinero de un trabajo, aunque no se retuvieron los ingresos federales sobre los ingresos. Puede que haya recibido o no un Formulario 1099 para todos los ingresos.",如果您從工作中賺到錢，即使沒有預扣所得稅，也可以在此處輸入收入。您可能已經或可能沒有收到適用於所有收入的《表格 1099》。
agi.p.federalIncomeNotWithheldTT3,The income may have been earned through an app or website to:,Revni an ka te touche atravè yon aplikasyon oswa yon sit entènèt pou:,Доход мог быть получен через приложение или веб-сайт за:,这些收入可能经由应用程序或网站通过以下方式赚取：,소득은 다음과 같은 목적으로 앱 또는 웹사이트를 통해 발생했을 수 있습니다.,Thu nhập có thể kiếm được thông qua một ứng dụng hoặc trang web để:,Los ingresos pueden haberse generado mediante un aplicación o sitio web por:,這些收入可能經由應用程式或網站透過以下方式賺取：
agi.p.federalIncomeNotWithheldTT4,Your gross income includes all the income you received. We will subtract your expenses later.,"Pou plis enfòmasyon, visit :manageTaxesForYourGigWork",Для получения дополнительной информации перейдите по ссылке :manageTaxesForYourGigWork,欲了解更多信息，请访问 :manageTaxesForYourGigWork,자세한 정보는 :manageTaxesForYourGigWork 방문하세요.,"Để biết thêm thông tin, truy cập :manageTaxesForYourGigWork",Sus ingresos brutos comprenden todo el ingreso que usted recibió. Restaremos sus gastos más adelante.,如需瞭解更多資訊，請前往 :manageTaxesForYourGigWork
agi.p.federalIncomeNotWithheldTT5,"For more information, visit :manageTaxesForYourGigWork","Pou plis enfòmasyon, vizite :manageTaxesForYourGigWork",Для получения дополнительной информации перейдите по ссылке :manageTaxesForYourGigWork,欲了解更多信息，请访问 :manageTaxesForYourGigWork,자세한 정보는 :manageTaxesForYourGigWork 방문하세요.,"Để biết thêm thông tin, truy cập :manageTaxesForYourGigWork","Para más información, consulte la página :manageTaxesForYourGigWork*",如需瞭解更多資訊，請前往 :manageTaxesForYourGigWork
agi.p.foreignEarnedIncomeTT,,,,,2555(해외 근로소득 관련 안내)를 참조하십시오.,,,
agi.p.foreignEarnedIncomeTT1,"Foreign earned income is income earned while living and working outside the United States, District of Columbia, or U.S. possessions or territories.","Revni yo touche aletranje se revni yo touche pandan y ap viv ak travay andeyò Etazini, Distri Columbia, oswa posesyon oswa teritwa Etazini.","Доход, полученный за рубежом, — это доход, полученный во время проживания и работы за пределами Соединенных Штатов, округа Колумбия или владений или территорий США.",境外所得收入是指在美国、哥伦比亚特区或美国属地或领土以外生活和工作时赚取的收入。,"해외 근로소득은 미국, 컬럼비아 특별구 또는 미국 영토·속령 이외의 지역에서 거주하며 일하면서 벌어들인 소득을 말합니다.","Thu nhập kiếm được ở nước ngoài là thu nhập kiếm được khi sống và làm việc bên ngoài Hoa Kỳ, Đặc khu Columbia hoặc các thuộc địa hoặc vùng lãnh thổ của Hoa Kỳ.","Ingresos devengados en el extranjero son ingresos que generó mientras vivía y trabajaba fuera de los Estados Unidos, el Distrito de Columbia, o de las posesiones o territorios estadounidenses.",境外所得收入是指在美國、哥倫比亞特區或美國屬地或領土以外生活和工作時賺取的收入。
agi.p.foreignEarnedIncomeTT2,"If you’re a U.S. government employee working outside the United States, that income is not considered foreign earned.","Si ou se yon anplwaye gouvènman ameriken k ap travay andeyò Etazini, revni sa a pa konsidere kòm revni ki touche aletranje.","Если вы являетесь государственным служащим США, работающим за пределами Соединенных Штатов, этот доход не считается полученным за рубежом.",如果您是在美国境外工作的美国政府雇员，则该收入不应视为境外所得收入。,"미국 외 지역에서 근무하는 미국 공무원의 경우, 해당 소득은 해외 근로소득으로 간주되지 않습니다.","xNếu quý vị là nhân viên chính phủ Hoa Kỳ làm việc bên ngoài Hoa Kỳ, thu nhập đó không được coi là kiếm được ở nước ngoài.","Si usted es empleado del gobierno de los Estados Unidos trabajando fuera de los Estados Unidos, ese ingreso no se considera ingreso devengado en el extranjero.",如果您是在美國境外工作的美國政府雇員，則該收入不應視為境外所得收入。
agi.p.foreignEarnedIncomeTT3,"If you're not a government employee and you work at an embassy, we consider that income as foreign income for the EITC.","Si ou pa yon anplwaye gouvènman an epi wap travay nan yon anbasad, nou konsidere revni sa kòm revni ki touche aletranje.","Если вы не являетесь государственным служащим и работаете в посольстве, мы считаем этот доход полученным за рубежом.",如果您不是政府雇员并且在大使馆工作，我们将该收入视为境外所得收入。,공무원이 아니고 대사관에서 근무하는 경우 해당 소득은 해외에서 벌어들인 것으로 간주합니다.,"Nếu quý vị không phải là nhân viên chính phủ và quý vị làm việc tại đại sứ quán, chúng tôi coi thu nhập đó là kiếm được từ nước ngoài.","Si usted no es un empleado del gobierno y trabaja en una embajada, consideramos que ese ingreso es devengado en el extranjero",如果您不是政府雇員並且在大使館工作，我們將該收入視為境外所得收入。
agi.p.foreignEarnedIncomeTT4,"For more information, see :form2555.","Pou plis enfòmasyon, gade :form2555",Для получения дополнительной информации см. раздел :form2555,有关详细信息，请参阅关于,자세한 내용은 양식 :form2555,"Để biết thêm thông tin, hãy xem :form2555","Para más información, consulte la página :form2555 (información sobre el Formulario 2555, Ingreso devengado en el extranjero)*** en inglés. ",有關詳細資訊，請參閱
agi.p.foreignEarnedIncomeTT5,"Note: If you elect to file Form 2555, you are not eligible to claim the EITC.","Nòt: Si ou chwazi ranpli Fòm 2555, ou pa kalifye pou reklame EITC a.","Примечание: Если вы решите подать Форму 2555, вы не имеете права на получение EITC.",注意：如果您选择提交《表格 2555》，则您不符合资格申请 EITC。,메모: 양식 2555를 제출하기로 선택한 경우 EITC를 청구할 수 없습니다.,"Lưu ý: Nếu quý vị chọn nộp Mẫu 2555, quý vị không đủ điều kiện để yêu cầu EITC.","Nota: si decide presentar el Formulario 2555, usted no es elegible para reclamar el crédito tributario por ingreso del trabajo (EITC, por sus siglas en inglés).",注意：如果您選擇提交《表格 2555》，則您不符合資格申請 EITC。
agi.p.healthInsuranceTT,"Enter any premiums you paid pre-tax for health insurance that you didn't include in the HSA, FSA, or other “cafeteria plan” section.","Antre nenpòt prim ou te peye anvan taks pou asirans maladi ou pa ajoute nan HSA, FSA, oubyen lòt seksyon ""plan kafeterya"".","Внесите все страховые премии, уплаченные до уплаты налогов за медицинское страхование, которые вы не включили в раздел HSA, FSA или другой «план кафетерия» (Программа, предлагающая работникам выбирать наиболее привлекательную для них форму пенсионного обеспечения).",输入您税前支付的医疗保险保费（未包括在医疗储蓄账户、灵活支出安排或其他“自助餐式福利计划”中）。,"귀하가 HSA, FSA, 기타 “카페테리아 플랜” 부분에 포함되지 않은 건강 보험에 지급한 세전 보험료를 입력하세요. ","Nhập bất kỳ khoản phí mua bảo hiểm nào mà quý vị đã trả trước thuế cho bảo hiểm y tế mà quý vị đã không bao gồm trong HSA, FSA hoặc mục “chương trình phúc lợi tự chọn” khác.","Ingrese cualquier prima que pagó antes de los impuestos para el seguro de salud que no está incluida en la sección de las cuentas HSA, FSA y otros ""planes cafetería"".",填入您為未包含在健康儲蓄帳戶、靈活支出帳戶或其他「自助選配計劃」部分中的健康保險支付的稅前保費。
agi.p.hsaTT1,"Enter any Health Savings Account (HSA) contributions that you didn't include under HSA, FSA, or other “cafeteria plan” above.","Antre nenpòt kontribisyon Kont Epay Sante (HSA) ke ou pa t ajoute anba HSA, FSA, oubyen lòt ""plan kafeterya"" anlè a.","Введите любые взносы на Медицинский сберегательный счет (HSA), которые вы не включили в раздел HSA, FSA или другой «план кафетерия» выше.",输入您任何健康储蓄账户 (HSA) 供款（未包括在上面的医疗储蓄账户、灵活支出安排或其他“自助餐式福利计划”中）。,"HAS, FSA, 혹은 기타 ""카페테리아 플랜""에 따라 귀하가 포함하지 않은 건강 저축 계정(HAS) 기여 금액을 입력하세요.","Nhập bất kỳ khoản đóng góp nào cho Tài Khoản Tiết Kiệm Y Tế (HSA) mà quý vị đã không bao gồm trong HSA, FSA hoặc ""chương trình phúc lợi tự chọn"" ở trên.","Ingrese cualquier aportación a una cuenta de ahorro para la salud (HSA) que no está incluida en la sección de las cuentas HSA, FSA y otros ""planes cafetería"".",填入您未包含在上述健康儲蓄帳戶、靈活支出帳戶或其他「自助選配計劃」下的任何健康儲蓄帳戶 (HSA) 投入金額。
agi.p.hsaTT2,For more information visit :irsPub969,Pou plis enfòmasyon vizite :irsPub969,Для получения дополнительной информации перейдите по ссылке :irsPub969,欲了解更多信息，请访问 :irsPub969,자세한 사항은 :irsPub969를 참조하세요.,"Để biết thêm thông tin, truy cập :irsPub969","Para obtener más información, visite :irsPub969",如需瞭解更多資訊，請前往 :irsPub969
agi.p.investmentIncomeOver1,You can't claim the earned income credit if your investment income is more than :amount.,Ou pa kapab reklame Kredi Sou Revni Ou Fè si revni envèstisman ou plis pase :amount.,"Вы не можете претендовать на налоговый зачет за заработанный доход, если ваш доход от инвестиций превышает :amount.",如果您的投资收入超过 :amount，则您不能申请劳动所得抵免。,귀하의 투자 소득이 :amount이상이면 근로 소득 공제를 신청할 수 없습니다.,Quý vị không thể yêu cầu tín thuế thu nhập kiếm được nếu thu nhập đầu tư của quý vị nhiều hơn :amount.,No puede reclamar el crédito por ingreso del trabajo si su ingreso de inversiones supera el monto de :amount.,如果您的投資收入超過 :amount，則不能申領勞動所得稅務優惠。
agi.p.investmentIncomeOver2,See :pub550 for more information., Gade :pub550 pou plis enfòmasyon.,Более подробную информацию см. :pub550.,欲了解更多信息，请参阅 :pub550。,구체적인 내용은 :pub550를 확인하세요.,Xem :pub550 để biết thêm thông tin.,"Para más información, consulte la :pub550 (Publicación 550, Ingresos y gastos de inversiones), en inglés.",請參閱 :pub550 以瞭解更多資訊。
agi.p.investmentIncomeOver3,"Use Worksheet 1 in :pub596, to figure your investment income.","Itilize Fèyè 1 nan :pub596, pou kalkile revni envestisman ou.","Используйте Учетную ведомость 1 в :pub596, чтобы рассчитать свой доход от инвестиций.",使用 :pub596 中的工作表 1 来计算您的投资收入。,귀하의 투자 소득을 계산하기 위해 :pub596에 작업표 1을 사용하세요.,Sử dụng Tờ Lược Toán 1 trong :pub596 để tính thu nhập đầu tư của quý vị.,"Utilice la hora de trabajo 1 de la :pub596, para calcular sus ingresos de inversiones.",使用 :pub596 中的工作表 1 以計算您的投資收入。
agi.p.investmentsTT1,Investment income for the EITC includes:,Revni envestisman pou EITC a gen ladan:,Инвестиционный доход для EITC включает:,符合 EITC 资格的投资收入包括：,근로 소득 세액공제에 대한 투자 소득은 다음이 포함됩니다.,Thu nhập đầu tư cho EITC bao gồm:,"Para los propósitos del crédito tributario por ingreso del trabajo (EITC, por sus siglas en inglés), el ingreso de inversión incluye:",EITC 的投資收入包括：
agi.p.investmentsTT2,See :irsPub550 for more information.,Gade :irsPub550 pou plis enfòmasyon.,Для получения дополнительной информации см. :irsPub550.,请参阅 :irsPub550，获取更多信息。,자세한 사항은 :irsPub550를 참조하세요.,Xem :irsPub550 để biết thêm thông tin.,Consulte la publicación :irsPub550 para obtener más información.,請參閱 :irsPub596，獲取更多資訊。
agi.p.investmentsTT3,"Use Worksheet 1 in :irsPub596, Earned Income Credit, to figure your investment income if any of the following statements are true for :year:",Itilize Fèy travay 1 nan :irsPub596 pou kalkile revni envestisman ou si nenpòt nan deklarasyon sa yo se vre pou :year:,"Используйте Рабочий лист 1 в :irsPub596, чтобы рассчитать свой инвестиционный доход, если любое из следующих утверждений верно на :year год:",如果在 :year 年符合以下任何陈述，请使用 :irsPub596 中的《工作表 1》来计算您的投资收入：,"간행물 596의 근로소득세액공제용 워크시트 1을 사용하여, 다음 항목 중 하나라도 :year 년에 해당되는 경우 투자소득을 계산하십시오.","Sử dụng Bảng tính 1 trong :irsPub596, để tính thu nhập đầu tư của quý vị nếu bất kỳ tuyên bố nào sau đây đúng cho năm :year:",Use la hoja de trabajo 1 de la :irsPub596 para calcular su ingreso de inversión si es que alguna de las siguientes le aplican a usted en el :year: ,如果在 :year 年符合以下任何陳述，請使用 :irsPub596 中的《工作表 1》來計算您的投資收入：
agi.p.iraTT1,Enter any IRA contributions you made outside of your payroll contributions.,Antre nenpòt kontribisyon IRA ou te fè andeyò kontribisyon sou pewòl ou.,"Введите любые взносы IRA, которые вы сделали помимо взносов в фонд заработной платы.",输入您在工资供款之外的任何个人退休账户供款。,귀하의 급여 기여분을 제외하고 귀하의 IRA 기여 금액을 입력하세요.,Nhập bất kỳ khoản đóng góp cho IRA nào mà quý vị đã thực hiện ngoài khoản đóng góp trong sổ lương của mình.,Ingrese cualquier aportación a una cuenta IRA que realizó fuera de sus aportaciones de la nómina.,填入您在工資投入金額之外所做的任何個人退休賬戶投入金額。
agi.p.iraTT2,:dontIncludeAmountsAbove,:dontIncludeAmountsAbove,:dontIncludeAmountsAbove,:dontIncludeAmountsAbove,:dontIncludeAmountsAbove,:dontIncludeAmountsAbove,:dontIncludeAmountsAbove,:dontIncludeAmountsAbove
agi.p.iraTT3,"For more information see, :iraDeductionLimits.",Pou plis enfòmasyon gade :iraDeductionLimits,Для получения дополнительной информации смотрите :iraDeductionLimits,欲了解更多信息，请参阅 :iraDeductionLimits,자세한 정보는 :iraDeductionLimits를 확인하세요.,"Để biết thêm thông tin, xem :iraDeductionLimits","Para obtener más información, consulte :iraDeductionLimits",如需瞭解更多資訊，請參閱 :iraDeductionLimits
agi.p.mfjIncludeSpouse,Make sure to also include your spouse's income and adjustments.,Asire w ou enkli revni konjwen w ak ajisteman yo tou.,Обязательно укажите также доход вашего супруга и поправки.,确保还包括您配偶的收入和调整。,귀하의 배우자의 소득과 조정액,Bảo đảm bao gồm cả thu nhập và các mục điều chỉnh của người phối ngẫu của quý vị.,Asegúrese de también incluir los ingresos y ajustes de su cónyuge.,確保還包括您配偶的收入和調整。
