Key,lang-en.json,lang-ht.json,lang-ru.json,lang-zh-hans.json,lang-ko.json,lang-vi.json,lang-es.json,lang-zh-hant.json
filingStatus.p.noDependentsAgeWarning2,"If you file as married filing separately, you must have a qualifying child who lived with you in the U.S. for more than half of :year. See :irsPub596, for information on who qualifies for the EITC."," Si w ap ranpli kòm marye separeman, ou dwe gen yon timoun elijib ki te abite avèk ou Ozetazini pou plis pase mwatye :year. Gade :irsPub596, pou plis enfòmasyon sou ki moun ki elijib pou EITC.","Если вы имеете статус - супруги подающие декларацию отдельно, у вас должен быть отвечающий требованиям ребенок, который проживал с вами в США более половины :year. Информацию о том, кто имеет право на получение EITC, см. в :irsPub596.",如果您为已婚夫妇单独申报，您必须有一名符合条件的子女在 :year 在美国与您共同生活了半年以上。有关申请 EITC 的条件，请参阅 :irsPub596。,"만약 부부 개별 제출로 신고한다면, 귀하는 반드시 :year년의 반 이상 미국에서 귀하와 함께 산 적격 자녀가 있어야 합니다. EITC 적격자에 대한 자세한 정보는 :irsPub596를 확인하세요.","Nếu nộp hồ sơ theo diện vợ chồng khai riêng hồ sơ thuế, quý vị phải có một trẻ đủ điều kiện sống cùng mình ở Hoa Kỳ trong hơn nửa :year. Để biết thông tin về những người đủ điều kiện nhận EITC, xem :irsPub596.","Si usted presenta una declaración como casado/a que presenta una declaración por separado, debe tener un hijo que reúne los requisitos que vivió con usted en los Estados Unidos durante más de la mitad del año :year. Consulte la :irsPub596, para obtener más información sobre quién califica para el crédito tributario por ingreso del trabajo (EITC).",如果您是已婚各自申報，您在 :year 年必須有一名符合資格的子女與您在美國一起生活超過半年時間。請參閱 :irsPub596 以瞭解關於誰有資格獲得 EITC 的資訊。
filingStatus.p.noDependentsAgeWarning3,"You don't qualify for EITC without a qualifying child unless you, or your spouse if filing a joint return, are between age 25 and 64.","Ou pa kalifye pou EITC a san yon timoun kalifye sof si ou, oswa konjwen w lan si n ap fè yon deklarasyon konjwen, genyen ant 25 ak 64 lane.","Вы не имеете права на оформление EITC при отсутствии ребенка, соответствующиего требованиям, за исключением ситуации, когда вы или ваш супруг(-а) при подаче совместной декларации находитесь в возрасте от 25 до 64 лет.",如果没有符合条件的子女，则没有资格申请 EITC，除非您本人或配偶（如果共同申报）年龄在 25 周岁至 64 周岁。,"귀하 또는 귀하의 배우자가 공동 신고서를 제출하고 나이가 25세에서 64세 사이가 아니라면, 귀하는 적격 자녀가 없는 EITC에 적격하지 않습니다.",Quý vị không đủ điều kiện nhận EITC nếu không có trẻ đủ điều kiện trừ khi quý vị hoặc vợ/chồng của quý vị  từ 25 đến 64 tuổi nếu khai thuế chung.,"Usted no califica para el EITC si no tiene un hijo calificado a menos que usted, o su cónyuge si presentan una declaración conjunta, tengan entre 25 y 64 años.",除非您或您的配偶（如果共同申報納稅申報單）是 25 歲到 64 歲之間，否則您無法在沒有不符合資格子女的情況下申領 EITC。
filingStatus.p.noDependentsAgeWarning4,"You don't qualify for EITC without a qualifying child unless you, or your spouse if filing a joint return, are one of the following ages:","Ou pa elijib pou EITC san yon timoun elijib sof si ou menm oubyen mari w oubyen madanm ou ranpli yon deklarasyon ansanm, ou gen youn nan laj sa yo:","Вы не имеете права на получение EITC, не имея отвечающего требованиям ребенка, если вы или ваш супруг (супруга), если подаете совместную декларацию, не достигли одного из следующих возрастов:",由于没有一名符合条件的子女，所以您没有资格申请 EITC，除非在联合申报时，您或您的配偶满足以下年龄条件之一：,귀하 혹은 공동신고의 경우 귀하의 배우자가 다음의 나이 중 하나가 아니라면 적격 자녀 없이 EITC에 적격이 될 수 없습니다.,"Quý vị không đủ điều kiện nhận EITC nếu không có trẻ đủ điều kiện trừ khi quý vị hoặc người phối ngẫu của mình, trong trường hợp khai thuế chung, thuộc một trong những độ tuổi sau:","Usted no califica para el crédito tributario por ingreso del trabajo (EITC) sin tener un hijo que reúne los requisitos a menos que usted, o sú conyuge si presenta una declaración conjunta, tengan una de las siguientes edades:",除非您或您的配偶（如果共同申報報稅表）處於下列其中一個年齡層，否則您無法在沒有不符合資格子女的情況下申領 EITC：
filingStatus.p.noDependentsAgeWarningFS,You can't claim the EITC  if you are married and not filing a joint return with your spouse unless you lived with a qualifying child for more than half the year and either lived apart from your spouse for the last six months of :year1 or were  legally separated according to your state law under a written separation agreement or a decree of separate maintenance and lived apart from your spouse at the end of :year2.,"Ou pa kapab reklame EITC a si ou marye epi ou pap fè yon deklarasyon konjwen avèk mari oswa madanm ou, sof si ou tap viv avèk yon timoun kalifye pandan plis pase mwatye ane a epi swa ou pa t ap viv avèk konjwen w lan pandan sis (6) dènye mwa nan ane :year1 an oswa nou te fè yon separasyon legal selon lalwa eta nou an nan kad yon akò separasyon alekri oswa yon dekrè mentnans separe epi ou pa t ap viv avèk konjwen w lan nan fen :year2.","Вы не можете подать заявку на EITC, если вы состоите в браке и не подаете совместную налоговую декларацию с вашим (-ей) супругом (-ой), если вы не проживали с ребенком, дающим право на льготы, более полугода и вы живете отдельно от своего (-ей) супруга (-и) последние шесть месяцев :year1 года, либо были разделены по решению суда в соответствии с законодательством вашего штата по письменному соглашению о раздельном проживании супругов или указу о раздельном проживании, и жили отдельно от вашего (-ей) супруга (-и) в конце года.",如果您已婚且并未与配偶共同提交联合纳税申报表，则您不能申请EITC，除非您与符合条件的子女共同生活半年以上，并且在 :year1年的最后六个月与配偶分居，或遵照您所在州的法律，按书面分居协议或单独赡养令与配偶合法分手，并在年底与配偶分居。,"귀하가 결혼한 상태이고 귀하의 배우자와 공동 신고서를 제출하지 않은 경우, 귀하가 적격 자녀와 반년 이상 거주했거나 지난 :year1년의 마지막 6개월 동안 귀하의 배우자와 떨어져 거주했거나 서면 별거 계약 또는 별거 수당 법령에 따라 주법에 의해 법적으로 별거 중이고 :year2년 말에 귀하의 배우자와 떨어져 거주한 경우가 아니라면, EITC를 청구할 수 없습니다.",Quý vị không thể yêu cầu EITC nếu quý vị đã kết hôn và không khai thuế chung với vợ/chồng của mình trừ khi quý vị đã sống với một trẻ đủ điều kiện trong hơn nửa năm và sống xa vợ/chồng của mình trong sáu tháng cuối năm :year1 hoặc đã ly thân về mặt pháp lý theo luật tiểu bang của quý vị theo thỏa thuận ly thân bằng văn bản hoặc phán quyết chính thức về thỏa thuận ly thân và sống xa vợ/chồng của quý vị vào cuối năm :year2.,"No puede reclamar el EITC si está casado y no presenta una declaración conjunta con su cónyuge, a menos que haya vivido con un hijo calificado durante más de la mitad del año y que haya vivido separado de su cónyuge durante los últimos seis meses del :year1 o haya estado legalmente separado según las leyes de su estado de conformidad con un acuerdo de separación escrito o una sentencia de manutención por separación judicial y haya vivido separado de su cónyuge al final del año :year2.",如果您已婚並且未與您的配偶申報共同申報表，則您不能申領 EITC，除非您與符合資格的子女共同生活超過半年的時間，並且在 :year1 年的最後六個月與您的配偶分居，或者根據您所在州的法律，根據書面分居協議或分居贍養令合法分居，並在 :year2 底與您的配偶分居。
filingStatus.p.numOfDependentsTT1,Your child is a qualifying child if your child meets four tests. The four tests are:,Pitit ou a se yon timoun ki kalifye si pitit ou a satisfè kat tès. Kat tès yo se:,"Ваш ребенок считается отвечающим требованиям, если он соответствует четырем критериям. Четыре критерия:",如果您的子女通过四项测试，您的子女就是符合资格的子女。这四项测试是：,귀하의 자녀가 다음 네 가지 요건을 모두 충족하면 ‘적격 자녀’로 간주됩니다. 네 가지 요건은 다음과 같습니다.,Con quý vị là trẻ đủ điều kiện nếu con quý vị đáp ứng bốn bài kiểm tra. Bốn bài kiểm tra là:,Su hijo es un hijo calificado si el hijo cumple los cuatro requisitos. Los requisitos son:,如果您的子女透過四項測試，您的子女就是符合資格的子女。這四項測試是：
filingStatus.p.numOfDependentsTT2,To claim EITC with a qualifying child your child must have a valid SSN issued on or before the due date of your :year return (including extensions).,"Pou reklame EITC ak yon timoun ki kalifye, timoun lan dwe gen yon SSN ki valid Administrasyon Sekirite Sosyal la bay nan dat limit deklarasyon :year ou a oswa anvan (ki gen ladan ekstansyon yo).","Чтобы подать заявку на EITC, имея ребенка, отвечающего требованиям, ребенок должен иметь действующий номер социального страхования (SSN), выданный Управлением социального страхования не позднее установленной даты подачи вашей налоговой декларации за :year год (включая продления).",如希望与符合资格的子女一起申请 EITC，该子女必须在 2025 年申报表到期日或之前拥有社保局颁发的有效 SSN（包括延期）。,적격 자녀와 함께 EITC를 청구하려면 해당 자녀는 2025년 신고서(연장 포함) 마감일 또는 그 이전에 사회보장국에서 발급한 유효한 SSN을 가지고 있어야 합니다.,"Để yêu cầu EITC với một đứa trẻ đủ điều kiện, đứa trẻ phải có SSN hợp lệ do Cơ Quan An Sinh Xã Hội cấp vào hoặc trước ngày đến hạn khai thuế năm :year của quý vị (bao gồm cả gia hạn).","Para poder reclamar el Crédito Tributario por Ingreso del Trabajo (EITC, por sus siglas en inglés) con un hijo calificado, dicho hijo tiene que tener un número de Seguro Social válido, emitido por la Administración de Seguro Social en o antes de la fecha de vencimiento de su declaración de impuestos para el :year (inclusive de las prórrogas).",如希望與符合資格的子女一起申請 EITC，該子女必須在 2025 年申報表到期日或之前擁有社保局頒發的有效 SSN（包括延期）。
filingStatus.p.numOfDependentsTT3,"For more information, see :irsPub596 for more information on a valid Social Security Number and if you have a qualifying child.","Pou plis enfòmasyon, gade :irsPub596, Earned Income Credit pou plis enfòmasyon sou yon Nimewo Sekirite Sosyal ki valid epi si ou gen yon timoun ki kalifye.",Для получения дополнительной информации смотрите :irsPub596,欲了解更多信息，请参阅 :irsPub596,자세한 정보는 :irsPub596을 확인하세요.,"Để biết thêm thông tin, xem :irsPub596","Para más información, consulte la :irsPub596, Crédito por Ingreso del Trabajo (EIC), y obtener información sobre un número de Seguro Social válido y si tiene un hijo calificado.",如需瞭解更多資訊，請參閱 :irsPub596
filingStatus.p.primarySupportTT1,You provided primary support if you paid more than half of the person's expenses during the year.,Ou te bay sipò prensipal si ou te peye plis pase mwatye nan depans moun nan pandan ane a.,"Вы оказывали основную поддержку, если вы оплачивали более половины расходов этого человека в течение года.",您提供的主要支护，如果您承担了这一年超过一半的该个人支出。,귀하가 해당 연도에 해당인의 비용의 반 이상을 부담했다면 주요 부양을 제공한 것입니다.,Quý vị là nguồn trợ cấp chính nếu đã trả hơn một nửa chi phí của người đó trong năm.,Usted proporcionó manutención principal si pagó más de los gastos de la persona durante el año.,如果您在一年中支付了該人一半以上的費用，則主要援助是由您提供。
filingStatus.p.primarySupportTT2,Individual expenses include:,Depans endividyèl yo enkli:,Индивидуальные расходы включают:,个人支出包括：,개인 비용에는 다음이 포함됩니다.,Các chi phí cá nhân bao gồm:,Los gastos individuales incluyen los siguientes:,個人費用包括：
filingStatus.p.primarySupportTT3,"Include this person's portion of shared expenses, such as:","Enkli pati moun sa a nan depans pataje yo, tankou:","Включите расходы этого человека в общие расходы, такие как:",包括共担支出的该个人的部分，例如：,다음과 같은 해당인의 공유 비용의 일부를 포함합니다.,"Bao gồm phần chi phí được chia sẻ của người này, chẳng hạn như:","Incluya la porción de los gastos compartidos de esta persona, tales como:",包括此人在分攤的費用中的部分，例如：
filingStatus.p.skipAhead,On this step you will be asked about how you plan to file your :year taxes. You must answer these questions in order.,"Nan etap sa a, yo pral mande w ki jan ou fè plan pou depoze taks :year ou. Ou dwe reponn kesyon sa yo nan lòd.","На этом шаге вас спросят о том, как вы планируете подавать свои налоги за :year. Вы должны ответить на эти вопросы по порядку.",在这一步中，您将被问到您打算如何对您 :year 的税项进行申报。您必须按顺序回答这些问题。,이 단계에서는 어떻게 귀하의 :year 년 세금을 신고 하려고 하는지에 대해 질문할 것입니다. 반드시 질문에 순서대로 답해야 합니다.,"Ở bước này, quý vị sẽ được hỏi về cách bản thân dự định khai thuế của mình. Quý vị phải trả lời những câu hỏi này theo thứ tự.","En este paso, se le harán preguntas sobre cómo planea presentar sus impuestos del año :year. Debe responder estas preguntas en orden.",在此步驟中，您將被問及您計劃如何申報 :year 年的稅款。您必須按順序回答這些問題。
filingStatus.p.skipAheadNoYear,On this step you will be asked about how you plan to file your taxes. You must answer these questions in order.,"Nan etap sa a, y ap mande ou kòman ou planifye pou depoze taks ou yo. Ou dwe reponn kesyon sa yo nan lòd.",,,이 단계에서 귀하는 어떻게 귀하의 세금을 제출할 계획인지에 관하여 질문을 받을 것입니다. 반드시 순서대로 질문에 답하세요.,"Ở bước này, quý vị sẽ được hỏi về cách bản thân dự định khai thuế của mình. Quý vị phải trả lời những câu hỏi này theo thứ tự.","En este paso, se le harán preguntas sobre cómo planea presentar sus impuestos del año. Debe responder estas preguntas en orden.",
filingStatus.p.spouseQualifiedHomelessYouthTT1,An individual who was a foster youth between the ages of 14-17.,Yon moun ki te yon jèn adoptif ant 14 ak 17 an.,"Человек, который был приемным подростком в возрасте 14-17 лет.",指年龄 14 至 17 岁的曾被领养的青少年。,만 14~17세사이에 위탁 청년이었던 개인 ,Một cá nhân từng là thanh thiếu niên được nhận nuôi tạm trong độ tuổi từ 14 đến 17.,Una persona que fue un joven que estuvo en una casa de crianza entre los 14 y 17 años-,14 — 17 歲之間曾為寄養青年的人士。
filingStatus.p.spouseQualifiedHomelessYouthTT2,An individual who is homeless and self-supporting.,Moun ki san kay ak otonòm.,"Лицо, не имеющее жилья и самостоятельно обеспечивающее себя.",指无家可归、自给的个人。,거주지가 없고 스스로 부양하는 개인,Một cá nhân là người vô gia cư và đang tự nuôi sống bản thân.,Una persona que no tiene hogar y es independiente,一名無家可歸並自給自足的人士。
filingStatus.p.spouseStudentTT1,"A specified student is an individual who during :year carried at least half the normal full-time workload at a higher education institution, for a period of 5 months or greater, and who is not a qualified former foster youth or a qualified homeless youth.","Yon etidyan espesifik se yon moun ki, pandan :year konplete omwen mwatye nan kantite travay nòmal aplentan nan yon enstitisyon siperyè, pou yon peryòd 5 mwa oubyen plis, epi ki pa yon ansyen jèn ki kalifye oubyen yon jèn ki kalifye ki san kay.","Определенный студент - это человек, который в течение :year выполнял как минимум половину обычной дневной нагрузки в высшем учебном заведении, в течение 5 месяцев или более, и который не является соответствующим требованиям бывшим приемным молодым человеком или соответствующим требованиям бездомным молодым человеком.",特定学生是指在 :year 期间在高等教育机构、在 5 个月或以上的时间里，至少完成了一半正常全日制学习量的个人，并且其不是符合条件的曾被领养青少年或符合条件的无家可归青少年。,특화 학생이란 :year년에 고등 교육 기관에서 5개월 이상 기간 동안 일반 전일제 학업량의 반 이상을 수행하는 학생이며 적격 이전 위탁 청년 혹은 적격 청년 노숙인이 아닌 학생입니다.,Học sinh/sinh viên được xác định là một cá nhân mà trong :year đã thực hiện ít nhất một nửa khối lượng công việc toàn thời gian thông thường tại một cơ sở giáo dục bậc cao trong thời gian từ 5 tháng trở lên và không phải là thanh thiếu niên từng được nhận nuôi tạm đủ điều kiện hoặc thanh thiếu niên vô gia cư đủ điều kiện.,"Un estudiante especificado es una persona que durante el año :year tuvo, al menos, la mitad de las unidades requeridas a tiempo completo en una institución de educación superior, para un período de 5 meses o más, y que no es un joven calificado que estuvo en una casa de crianza o un joven calificado sin hogar.",指定學生指的是在 :year 年期間在高等教育機構註冊至少一般全日制時數量的一半的個人，並且為期 5 個月或更長時間，並且不是合格的前寄養青年或合格的無家可歸青年。
filingStatus.p.spouseStudentTT2,"For information about whether your educational program or workload meets the qualifications for you to be a specified student, see the Instructions to :irsForm8863."," Pou konnen si pwogram etid ou oubyen kantite travay ou satisfè kritè yo pou ou kapab yon elèv espesifik, gade Enstriksyon yo pou :irsForm8863.","Для получения информации о том, соответствует ли ваша образовательная программа или нагрузка требованиям, позволяющим вам быть указанным студентом, см. инструкцию к :irsForm8863.",有关您的教育计划或学习量是否符合成为指定学生的资格的信息，请参阅以下说明 :irsForm8863.,귀하의 교육 프로그램 혹은 학업량이 특화 학생 적격에 충족하는지에 대한 정보는 :irsForm8863에 지침을 확인하세요.,"Để nắm được thông tin về việc liệu chương trình giáo dục hoặc khối lượng công việc của quý vị có đáp ứng tính đủ điều kiện để quý vị trở thành học sinh/sinh viên được xác định hay không, xem Hướng Dẫn cho :irsForm8863.","Para obtener información sobre si su programa educativo o curso cumple con las calificaciones para que usted sea un estudiante especificado, consulte las instrucciones para el :irsForm8863.",有關您的教育課程或課程時數是否符合成為指定學生的資格的資訊，請參閱 :irsForm8863 的說明
filingStatus.p.spouseValidSSNTT1,"To claim EITC with a qualifying  child, the child must have a valid SSN issued by the Social Security Administration on or before the due date of your :year return (including extensions)."," Lè w ap ranpli yon deklarasyon kolektif, oumenm ak konjwen ou dwe genyen yon Nimewo Sekirite Sosyal (SSN) ki valab ki soti nan Administrasyon Sekirite Sosyal la oubyen anvan dat limit deklarasyon taks :year ou (ki gen ladan ekstansyon).","При подаче совместной декларации вы и ваш супруг должны иметь действительный номер социального обеспечения (SSN), выданный Администрацией социального обеспечения на дату или до даты подачи вашей налоговой декларации за :year (включая продление).",进行联合申报时，您和您的配偶必须有由社会安全局在您的 :year 报税表的截止日期（包括延期）当日或之前签发的有效社会安全号码 (SSN)。,공동 신고서를 제출할 때 귀하와 귀하의 배우자는 :year 세금 신고서의 기한 이전에(연장 포함) 사회보장국에서 발급한 반드시 유효한 사회 보장 번호(SSN)가 있어야 합니다.,"Khi nộp hồ sơ khai thuế chung, quý vị và người phối ngẫu phải có số An Sinh Xã Hội (SSN) hợp lệ do Cơ Quan Quản Lý An Sinh Xã Hội cấp vào hoặc trước ngày đến hạn của tờ khai thuế :year của quý vị (đã bao gồm khoảng gia hạn).",Cuando usted presenta una declaración conjunta usted y su cónyuge deben tener un número de seguro social (SNN) válido que la Administración de Seguro Social haya emitido en la fecha de vencimiento de la declaración de impuestos del año :year o antes (incluidas las prórrogas).,共同申報報稅表時，您和您的配偶必須擁有由社會安全局在您 :year 年的報稅表到期日或之前（包括延期的申報截止）簽發的有效社會安全號碼（SSN）。
